{
  "$schema": "https://json-schema.org/draft/2020-12/schema",
  "title": "QimiaoDaily manual calendar events",
  "type": "array",
  "items": {
    "type": "object",
    "required": ["id", "eventDate", "kind", "title", "detail", "source", "sourceUrl", "enabled"],
    "properties": {
      "id": { "type": "string", "minLength": 1 },
      "eventDate": { "type": "string", "format": "date" },
      "kind": { "type": "string", "minLength": 1 },
      "title": { "type": "string", "minLength": 1 },
      "detail": { "type": "string" },
      "source": { "type": "string", "minLength": 1 },
      "sourceUrl": { "type": "string" },
      "enabled": { "type": "boolean" }
    }
  }
}
